{
  "$schema": "../../../meta.schema.json",
  "slug": "article/2025-12/live-editor",
  "locales": ["ko", "en"],
  "createdAt": "2025-12-20",
  "updatedAt": "2025-12-20",
  "category": "기술",
  "tags": [],
  "image": "i1.jpg",
  "title": {
    "ko": "고객 사이트에서 동작하는 React + Tailwind 앱 효율적으로 개발하기 (Production-Ready)",
    "en": "Efficiently Building a React + Tailwind App That Runs on Customer Sites (Production-Ready)"
  },
  "summary": {
    "ko": "배너 삽입 시스템을 만들고 동작시키고 개발하면서 이렇게 특수한 환경에서의 프론트엔드 개발에 대해 알아봅니다.",
    "en": "Build a banner injection system and learn how to develop front-end apps in this special environment."
  },
  "imageAlt": {
    "ko": "포스트잇 사진.",
    "en": "Sticky note photo."
  }
}
